TITLES,REVIEW,COMMENTS,TIME
드뎌 스타일러…,​엘지 오브제 스타일러 들였어요. 몇년 프리랜서로 일하다가 정규직으로 취업하면 스타일러부터 사야지 했는데 막상 취업하고는 1년간 고민했어요. 겨울에는 정말 필요한 듯해서 사려고 했으나 오브제는 가격이 안떨어져서… 2월말에 가격 괜찮은 듯해서 결제하고 지난 금욜날 배송받았어요. 오랜 숙제를 해결한 느낌이네요 ㅋㅋ​,"[['오 추카드려요~ \n얼마에 사셨어요?'], ['162에 몇천원 더했어요.'], ['마룻바닥 예뻐요^^  스타일러는 저도 너무 갖고파요'], ['가전 하나 들이기 쉽지 않네요 ㅋㅋ'], ['와. 가격도 좋네요^^ 댓글보니.\n스타일러 둘데가 없네요.저도 ㅜ'], ['거실에 두어도 이질감 없이 이뽀요😍'], ['도저히 방에는 넣을 곳이 없어서 인테리어 포기하고 거실로 나왔어요. 젤 아쉬운 부분이에요..;;;'], ['이쁘네요. 깔끔하고.잘 어울려요~'], ['감사합니다.^^*'], ['몇벌짜리에용?'], ['5벌이요..'], ['첫댓글 보고 봤는데 마루 진짜 예뻐요!'], ['저 위치에 딱 잘 어울려요~'], ['화이트.이쁘네요~~'], [''], ['깔끔해서 집이랑도 잘 어울리네요 저는 스타일러 나왔을 때부터 맘에만 품고 있는 ㅠㅠ'], ['혹시 모델명이 어떻게 되나요?!?'], ['LG 오브제컬렉션 스타일러 S5BFO 에요.'], ['오브제 스타일러는 예쁘네요. 저는 일반 스타일러 4년전에 구입했는데-아주 만족해하며 쓰고 있어요.'], ['정말 효과가 좋은가요? 항상 하나 사야하나 말아야하나 생각하네요'], ['직장 다니시면 정말 강추해요. 특히 매일 세탁해서 입을 수 없는 겨울옷이나 자켓은 스타일러 돌려서 입으니 정말 좋더라구요.'], ['와우... 좋아보입니다.']]",2022.03.06. 14:17
"스타일러, 인비오, 카시트 등","LG 스타일러구매 1년반, 구매가격 약 17300위안판매가 8000원​주니어 카시트 판매가격 500원","[['혹시 스타일러 판매 이유를 여쭤봐도 될까요?'], ['중국에 오래 살 줄 알고 모든 가전 구매했는데, 봉쇄에 질려서 급하게 한국 귀국하게 됐어요..😅 다른 가전은 아직 제가 써야해서 못올리구요…이건 올려보고 팔리면 처분하고 안팔리면 한국가져갈 생각 하고 있었어요~'], ['그리고 7월에 들어가기전 아이들 침대랑 옷장도 올릴거에요^^'], ['친절한 답변 감사합니다.저도 상의 한번 해 보고 구매하게 되면 연락 드리겠습니다.'], ['네~ 감사합니다:)'], ['카시트 인비오 완료']]",2022.06.16. 22:50
Lg 스타일러 블랙에디션,"안녕하세요^_^ 제이웨딩 식구님들 🧸🧸​랑부님들도 꼭 신혼집에 챙겨가실 꿀템있으신가요? 요즘 식세시 공기청정기 커피머신 좋은 물건들이 참 많은거같아요 !!​전 신혼집 들어가게 되면 스타일러는 꼭 사서 들어가려구해요 ~~ 요즘 상담도 받으면서 다니는데 오늘 백화점에 가니깐 Lg 스타일러 블랙에디션 이라고 하는ㄷㅔ 너무 이쁘도라구요 색깔도 완조이 제 스타일 !! 안방 드레스 룸에 스타일러가 딱 들어가게끔 공간이 있어서 드레스룸랑도 잘맞고 넘넘 이쁠거같아요🖤​살균, 탈취, 스타일링 다 되고 가죽 마 울 뭐 상관없이 거의 다 돌려도 된다규 하더라구요 !!!!아직 신혼집 입주전이라 상담만 받고 왔는데 마음은 이미 구매 완료입니닷 ㅋㅋㅋㅋㅋㅋㅋㅋ","[['스타일러 넘사고픈데 ㅜㅜ공간이업네여'], ['저도 스타일러는 꼭 사려구용'], ['스타일러는 진짜 사고 싶어요!!!'], ['ㅠㅠ 스타일러 사고싶었는데....전세집이 너무 작아 이사가면 사야할까바요 ㅠㅠ'], ['저는 에어드레서 구매했는데 이거슨 신세계 입니당~'], ['저도 스타일러는 꼭 사고싶더라구요~'], ['스타일러 안필요하다구 생각했는데 사용하시는 분들보니까 너무 좋은것 같아여!! ㅠㅠㅠ 나중에 사려구여 ㅠㅠㅠ'], ['스타일러 저도 꼭 사려구요!!'], ['요즘엔 스타일러 많이 구입하시는 것 같아요 ㅎㅎ'], ['스타일러 꼭 사고 싶은데 너무 비싸요...ㅠㅠ'], ['스타일러 필요없을 줄 알았는데 한번 맛보니...있으면 좋겠더라구요ㅎㅎㅎ'], ['스타일러....진짜 사고싶은데 너무 비싸더라구요!!!ㅠㅠㅠㅠ그래서 사야되나 말아야되나 고민중이에요!'], ['저도 나중에 꼭 신혼집 가서 스타일러 구입할꺼에요~!']]",2022.04.10. 20:03
스타일러 너.... 사릉한다❤,친구가 강추강추 하던 스타일러..눈독만 들이다 드디어 집에 모셨어요 ㅎㅎ음식냄새 안빠지거나 코트 소매 주름 때문에세탁소 자주 애용했던 저는... 하.. 1000%로만족 합니당!!  스타일러 시트까지 넣고 돌렸더니향수가 필요 없네용~ 으흥~ 너무 향긋향긋😚​1위 건조기 2위 스타일러 3위 로봇청소기4위 식세기 제맘속 순위 리스트 랍니다 ㅎㅎ​고민중 이신분 지르세효~~,"[['전 삼성꺼 에어드레서인데 없음 안된다능..ㅎㅎ5벌짜린데 붙박이장만큼 큰것도 나왔음 좋겠어여ㅎㅎㅎ저 리스트중 로봇청소기만 없네여ㅜㅜ고민만 몃달째😅'], ['붙박이장만큼~ ㅎㅎ 저두 삼성꺼 픽했어용~ 헤헤'], ['아 제목보고 스타일러라해서 엘지꺼로 착각했는데 내부보니 삼성꺼네여ㅎㅎ 삼성은 에어드레서쥬😁'], ['고장날때까지 팍팍 써줘야 겠어용^^'], ['대형인형도 돌리면 좋고 특히 이맘때 요긴하게 씁니당ㅎㅎ코로나 필수품이쥬😁 축하드립니당👏👏'], ['바닥에 많이 널부러져 있고 아기매트 쓰는데 로봇청소기 괜찮을까요? 전부 주워놓고 의자같은 건 구석으로 정리해둬야하죠? 저 정말 청소기 부자인데 ㅋㅋ 에브리* 복도 전부 못하는거 보고 로봇청소기는 눈길도 안줬는데 급 관심생기네요 ㅎ'], ['저는 삼성 제트봇 쓰거든용~ 이게\n미리 스마트폰으로 위치 선택해서\n제가 지정한곳 돌아가구요. 장난감\n있음 피해서 청소해용 ㅎㅎ 저두\n오늘 거실 빨래 꺼내놔서 폭탄인데\n거기빼고 열일 하더라구요~^^'], ['아 큰일인데요... 아 사고싶어져라 ㅠㅠ 저 지금 에브리* 삼성청소기 아쿠아청소기 스팀청소기 침구청소기 차량용작은청소기(머리카락 및 과자부스러기 즉시청소용) 으로 남편한테 청소기가 왜이래많냐고 잔소리먹는데 로봇청소기.... 써보고싶네요... 급 검색들어가 봅니다 ㅎㅎ'], ['저도 필립스 아쿠아 청소기, 무선 아쿠아 청소기, lg코드제로 쓰다가 먼지통 비우다\n빡쳐서 삼성으로 바꿨어요 ㅋㅋㅋ 맘님맘 충분히 이해합니당~ 저는.. 물걸래 로봇청소기 사고싶.....ㅎㅎㅎ'], ['완전공감 !!!! 청소기속 비울때 가루들이 싫어 저도 다른무선청소기 전부 처분하고 삼성샀어욤ㅎㅎ 물걸레청소기 40평대 이상이면 비추용.. 방 들어갔다나왔다 못하고, 긴 복도에 두면 복도만 주구창장왔다갔다 하고 무엇보다 걸레 손빨래 넘 싫어여 .. 잘 마르지도 않고 관리.잘못하면 냄새난다길래 안에 물넣는곳 물 잘 안빠져서 비우는것도 일..... 그래서 전 아쿠아 청소기 추가로 들였어요 ㅋㅋㅋㅋ 아쿠아청소기가 무거워도 속은 더 시원해요 ㅎㅎ'], ['맞아요. 무거워도 아쿠아 청소기만큼\n깨끗하게 된건 없졍~ 30평대라 고민\n했는데 이러나 저러나 걸레 빠는건\n비슷하군용 ㅎㅎ 패스해야겠어요^^'], ['스타일러만 없는데.. 2위라니..!!\n저..사야겠는데요? 😂'], ['평소에 세탁소 자주 애용하시는분이면\n강추드립니다. 애들도 아직 어려서\n바디필로우 인형 자주 빠는것도 힘들었는데 스타일러 들이자마자\n살균모드로 박살 내줬어용 ㅎㅎ'], ['저는 저 중에 스타일러만 없네요~데려오려고 관망중입니다~~~^^'], ['곧 애가 셋이다 보니 가전 욕심만\n커져요 ㅎㅎ 예전엔 어찌 살았나\n할머님 같은 말을 ~^^'], ['와우 로봇을 제치고 2위예요?!?!!? 와...저도 탐납니다 요거요거.......😍😍'], ['저는 세탁소 가는게 은근 귀찮아서 ㅎㅎ\n2위가 스타일러 예용~^^'], ['저는 없고 친구가 있는데 음식냄새도 없어지고 세탁소 갈일이 많이 줄어들었대요'], ['그니까요~ 세탁소 계절 바뀔때나 갈것 같아요^^'], ['향기시트는 어떤거쓰시나용? 제가쓰는거는향이안나는것같아요'], ['급하게 마트가서 샤프란 핑크 샀어요~\n필터 넣는곳에 2개 넣었더니 향기 장난\n아니게 찐해서 담엔 1개 펴서 넣을려구용^^'], ['좋으네요 ㅎㅎ 탁월한 선택이세요 요즘 살림도 장비빨이 좋아야해요 ㅎ'], ['그러게요 육아든 살림이든 장비빨 인가봐용~^^'], ['스타일러가 왜 필요한가 했더니 좋네요.'], ['일단 집에 들이니 잘써지니 뿌듯하네요^^']]",2022.01.21. 21:59
스타일러 실내제습기능 써보신분??,"스타일러 5년째 사용중인데 실내제습기능은 한번도 안써봤어요,,오늘 드레스룸이 꿉꿉한듯해서 돌리고 있는데요거 전기세 많이 나오나요?? 써보신분 알려주세요~~​수정♡찾아보니까 실내제습 1회 2시간 사용시 51원이네요맘놓고 오늘부터 사용합니다~","[['저 여름에 자주 쓰는데 ㅋㅋㅋ 전기세에 큰 변화는 없는거 같아요 ㅋㅋ 제습기능 너무 좋아요👍👍'], ['아 진짜요~맘놓고 있어도 되겠네요ㅋㅋ\n5년만에 오늘 눈에 들어왔어요;;\n알려주셔서 감사합니다^^'], ['저두 지금도 쓰고있는데 오히려 좋아요~^^'], ['그러게요ㅋㅋ이제야 알다니\n찾아보니까 전기세도 얼마 안나오네요ㅋ'], ['저도쓰는데 신세계입니당']]",2022.06.26. 21:12
"스타일러, 청소기, 세탁기 오브제로 통일~!!☺️",이사오면서 필요한 가전들 오브제로 맞췄어요~!! 첨에 알아볼땐 디자인만 다른데 가격이 비싼거같아 망설였는데 ㅋㅋ 막상가서 보니 넘 이뿌더라구요😅 인테리어값 포함한다 생각하구 질렀어요~ 화이트장 짜넣은 소박한 드레스룸에 오브제 스타일러와 청소기 두니 넘 깰꿈~ 크... 미리 사버린 저 존재감넘치는 건조기가 조금 눈에 걸리지만... 넘 맘에들어요~세탁기두 ㅠㅠ 세상깔끔!! 색상두 포근한 아이보리👍,"[['실례지만 장농은 어디껀가요? 밑에 뚫린 농 찾고있어서요^^'], ['수쿠퍼니텍에서 맞췄어요!']]",2022.07.13. 14:59
화곡동중고가전 중고냉장고 드럼세탁기 스타일러 매입 수거 방화동재활용센터,화곡동중고가전 중고냉장고 드럼세탁기 스타일러 매입 수거 방화동재활용센터​*일시:  2022년 8월26일 금요일 오후​*장소: 강서구 화곡동 빌라​*방문내용:냉장고 세탁기 스타일러 매입수거​*제품: LG510L냉장고 LG14k드럼세탁기*LG트롬스타일러​*비고사항:당일 빠른 매입진행​중고맨24는 국내최초 365일 연중무휴!!24시간 운영하는 중고가전 매장입니다.편하신 시간에 항시 방문하셔서 실매물을직접 보시고 구매하실수 있습니다!!가장많은 매물을 보유하고 있고거래조건 또한 가장좋은곳 입니다!!☆중고맨 물류센터 24시 영업중☆(남양주 오남읍 양지로장자길 3-6)​중고가전제품 온라인몰 바로가기클릭https://cafe.naver.com/taegirl1​​중고맨 홈페이지 바로가기클릭www.중고맨.com​​매입상담및 제품문의는 카톡이 빨라요!!https://open.kakao.com/o/s9PH7Qxc​​010 -5808 -6700​010 -8906 -9143​010 -2899 -6001​1644 -6462​*아래는 현장사진 입니다*​,"[[''], [''], ['']]",2022.08.26. 14:46
LG 스타일러(모델명 S5MBA) 추천 합니다,"​2년 가까이 잘 사용하고 있는 LG 스타일러(모델명 S5MBA) 추천 합니다가전 준비하면서 스타일러를 살까 말까 고민하시는 분들 많으실 것 같아요.저도 고민을 많이 했고, 많은 고민 후 구매해 잘 사용하고 있습니다.​장점​일단 저희 신랑은 매일 정장과 와이셔츠를 입어요! 그래서 더 필요했고 잘 사용하고 있는 것 같아요.아무래도 정장이나 와이셔츠는 잘 구겨지는 소재이기도 하고, 매번 한번입고 드라이를 맡길 수가 없어서 구매를 결정했는데 가장 큰 기여를 했어요. ​그리고 겨울 철에 패딩!!! 더불어 회식 하고 왔을때 냄새 빼기 정말 좋아요. 코트입고 고기집 회식 다녀오면 집 도착해서 무조건 옷들고 스타일러로 직행....​이것 말고도 장점을 뽑자면 아직 코로나 시대잖아요ㅠㅠ 옷들에 붙은 바이러스 그리고 미세먼저..스팀 코스로 옷 돌리고 나면 심리적으로 조금 편하더라구요.그리고 제습 기능!!! 에어컨을 드레스룸에는 따로 두지 않아서 가끔 스타일러로 제습코스도 해주고 있어요!​​단점​스팀 다리미 처럼 쫙쫙 펴주지는 못해요ㅠㅠ 그부분이 조금 아쉬워요그리고 생각보다 거대해욬ㅋㅋㅋㅋㅋ5벌이 들어가는 걸 구매해서 그런지 생각보다 공간을 많이 차지해요.마지막으로 저는 괜찮지만 소음이 크다는 분들도 계시더라구요. 저는 신경쓰일 정도는 아닌데 구매하실 분들은 참고하세요!!!​","[['스타일러 로망 있는데, 그래두 있으면 유용하겠어요 ^^']]",2022.04.12. 15:57
"lg스타일러미러,미세먼지공기청정기 렌탈 추천 보조금은 최대로 받으세요!",​,"[['공기청정기추천 이정도면 괜찮네요~'], ['저도 한 10곳 정도 전부 상담한 결과 여기가 지원을 가장 많이 주셨어요 그리고 소개까지 해주시면 지원 더 주시더라고요각 브랜드 다 있고, 렌탈 비용도 얼마안해서 만족스러워요 링크 공유 드릴게요~http://pf.kakao.com/_rtxmIb'], ['<< 주의사항 >>LG공기청정기도 제품별로 기종별로 가격차가 있고또한 제휴카드에 따라서도 월 렌탈료가 많이 달라집니다.그러므로 한번쯤 견적을 받아보시고 결정하시는게나중에 후회가 없습니다^^[ LG공기청정기 기종별 렌탈료 확인 ]✅ https://bit.ly/39tmsPV'], ['공기청정기추천 정보를 알아보고 있었는데 많은 도움이 됐습니다. 꼭 참고할게요~감사합니다!^^'], ['공기청정기추천 요새는 가전제품을 대부분 렌탈로 이용하는 경우가 많더라고요. 가전제품 기능이 좋아지는만큼 구매할 때 가격도 비싸기도 한데 렌탈을 하게 되면 매달 월요금으로 낼 수 있고 제휴 할인으로 더 저렴하게 이용도 가능하고 관리도 편해서 삶의 질이 올라가기 때문인데요. 저렴한 가격으로 신경쓸 일도 줄어드니 렌탈이 훨씬 이득인 것 같아요. 저도 이번에 정수기 새로 설치하려고 했는데 좋은 정보 얻어가네요~'], ['공기청정기추천 요즘은 직수정수기 중에서도 이 제품이 후기가 제일 좋던데요. 아직 문제가 될만한 안좋은 후기도 없고 편리하고 너무 좋다고하더라고요. 직수정수기 종류가 워낙 많기 때문에 어떤 제품을 렌탈해야하나 항상 고민할 수 밖에 없는데 여기서는 여러제품을 비교해볼 수 있고 사은품도 최대로 받을 수 있어서 너무 좋던데요. 당일에 사은품 지급까지 해주니 안심하고 가입하기 좋은 것 같아요.'], ['공기청정기추천 친구집에 사용하고 있는 모델이네용! 이 제품은 성능도 좋고 디자인도 깔끔하니 관리하기도 너무 좋다고 하더라고요. 친구가 맨날 정수기 정보 물어보고 이 제품 추천한다면서 사은품 많이 주는 업체도 알려주고 그랬었는데 알고보니 여기더라고요. 저도 빨리 아정당렌탈에 연락해서 상담받고 사은품 최대로 지급받아야겠네요'], ['공기청정기추천 이번에 사용하던 정수기가 갑자기 고장나서 새로 알아보게 됐는데요. 남편이랑 아이들이 다 정수기 물만 마셔서 좀 급한 상황이였는데 상담 때 말씀드리니 최대한 빨리 되도록 신경써주겠다 해서 빠른 설치 받았어요. 너무 감사하더라고요. 다음에도 가전제품 렌탈 할 일이 있으면 꼭 아정당 이용할 것 같아요. 설치 빨리 해주셔서 너무 감사했는데 사은품도 당일 저녁에 바로 들어오더라고요 정말 만족스러웠어요.'], ['공기청정기추천 이곳을 알게돼서 너무 다행이란 생각이 드네요. 몰랐는데 본사보다 여기서 렌탈하는 것이 훨씬 사은품을 많이 받을 수 있다고 하던데 진짜일줄은 몰랐거든요. 상담 받을 때까지도 긴가민가 했는데 설치하고 사은품 들어온 거 보고 실감이 나더라고요. 소비자 입장에서는 이곳저곳 비교해보는게 당연한거라고 생각했는데 여기 상담받고는 괜히 비교했다라는 생각이 들더라고요'], ['공기청정기추천 저는 이번에 너무 만족스럽게 설치를 하였는데요. 의심이 많은 성격이라 제가 직접 눈으로 보기 전까지는 잘 안믿는데 지인이 추천해준 곳이니 눈 딱 감고 한번 해보자 했는데 왜 이때동안 이런혜택을 못받고 렌탈을 이용했나 싶더라고요. 상담할 때 내용 그대로를 지킬뿐더러 설치날짜나 사은품 당일 지급까지 약속을 그대로 지키더라고요. 제품 기능도 하나하나 다 물어봤는데 친절하게 설명해주셔서 의심되는 마음이 점점 사라지더라고요. 진짜 당일 저녁에 사은품 주는 걸 보고 주변에 적극 추천하고 싶어졌어요. 상담도 이른아침부터 늦은 밤까지 진행된다고 하니 시간 여유되실 때 꼭 상담 받아보시길 바랄게요!'], ['공기청정기추천 렌탈 상품마다 하나하나 검색해서 알아보기가 너무 귀찮아서 그냥 아무업체에서 해야하나 별 차이가 있겠나 했는데 잘못된 생각이였더라고요! 무조건 사은품 혜택 많은 곳에서 하는 것이 중요하고 이왕이면 여러제품 한번에 비교할 수 있는 곳이 낫더라고요. 친구가 이곳 추천 안해줬으면 완전 손해보고 렌탈할뻔했어요. 이번에 알게된게 어디겠어요. 제품도 너무 만족스러운데 사은품까지 최대로 받았으니 정말 좋아요. 통신렌탈 같이 진행하고 있으니 알아보고 계신다면 꼭 상담받아보셨으면 하네용'], ['공기청정기추천 보통 다른 곳에서 렌탈 설치하게 되면 일정잡고 설치하고 사은품 혜택 받는 데까지 2주정도 시간이 소요된다고 하는데요. 저는 일주일도 안걸려서 설치받고 당일에 바로 사은품 받아서 좋더라고요. 그리고 사은품을 다른 제품을 준다고 하거나 설치받고 시간이 지난 뒤에 지급해준다는 곳이 있다면 의심해볼 필요가 있어요. 이왕이면 당일에 바로 지급해주는 곳으로 가입하는 것이 안전하다고 해요.'], ['친절한 상담과 혜택 최고입니다 http://pf.kakao.com/_rtxmIb']]",2022.05.16. 13:12
LG스타일러렌탈 제습기능까지 한번에 관리해요!,비가 점점 멎어가면서 습함도 서서히줄어들고 있습니다. 장마철에 많은 분들이 LG스타일러렌탈을 많이 찾아주셨습니다.습하기 때문에 빨래를 해도 꿉꿉하고습기가 있는 상태로 마르기 때문에 옷에그대로 남아있는 습기를 스타일러로관리를 해주면 보송한 상태로 착용을할 수 있습니다. 그래서 오늘은 장마철LG스타일러렌탈을 하신 고객님의 후기를가지고 왔습니다. 고민중이신 분들은 함께 후기를 읽어보시고 도움이 되시길 바랍니다.​[S3BF] 모델 렌탈 진행하신오O영고객님의 후기입니다.,"[['감사합니다'], ['잘보고 있습니다.'], ['잘보고 갑니다.'], ['잘봤습니다']]",2022.07.18. 12:11
스타일러장 문의,붙박이 시공하면서 스타일러장을 제작했는데 오브제 스타일러 5구 입니다. 넓이는 600인데 시공하시는분이 610으로 장이 해두셨어요완전 타이트 하고 엘지기사님이 타이트하다고 하셨는데스타일러가 움직이자나요? 어제 문이 안닫히는거에요...​ 스타일러는 수평 맞는데 밑에 물받이는 아예 안들어가고...아 이거 어떻게 해야 할까요ㅠㅠㅠㅠ? 진짜 붙박이장 스트레스 받습니다...  상단은 왼쪽이 딱 붙고 하단은 오른쪽이 딱붙고..스타일러는 수평이고...이러다 스타일러 고장나는건 아닌지...,"[['음.. 저도 붙박이에 스타일러 때려 넣을려다가.ㅠ 그냥 저희는 거실에 놔두고 쓰기로 했거든요. 기존에도 거실에 그냥 세워놓고 썼었는데.. 움직이죠.. 어느순간 보면 자리이동해있고.ㅠ 쓰시다보면 움직여서 부딪힐꺼 같아요.ㅠ'], ['붙박이장때문에 참 골치네여ㅠㅠ 감사합니당'], ['헐..스타일러가 움직이나요?? 1센치만 두묜된다고생각했는데'], ['어머 저도 몰랐네요 스타일러가 움직이나요 ??'], ['안녕하세여~ 지나가다 여쭈어요 사진처럼 빌트인 하려고 610 얘기 해둘려는 찰라에 글을 보게 되었어요 대개 붙박이 하신분들도 양쪽5cm씩 여유를두셨구요 사진상으로 봐선 여유공간이 작지 않고 딱 보기 좋을만큼 공간을 두신것 같아요 하지만 쓰시는분이 불편함을 느끼면 여유공간 더커야 되지 싶어요 그러기엔 너무 크면 안이뿌고..좌우 얼마씩 공간을 두면 이런문제가 안생길까요?\n위쪽은 문제 없어 보이는데 위쪽은 여유 공간은 몇센치 일까요?']]",2022.03.17. 15:49
펫스타일러 공동구매,"169,000원인 펫스타일러를 79,000원에 겟할 수 있는 기회 모두 놓치지 마세요❤️",[],2022.07.06. 01:45
엘지스타일러렌탈 손상없이 관리해요!,"매일 빨기는 옷감이 상할까 걱정 되고,안빨자니 땀도 흘리고, 냄새도 날까걱정하는 분들이 많을 것 같아요.그래서 그런지 요즘처럼 습하고 꿉꿉한날씨에 많은 분들께서 찾아주시는데요.오늘은 엘지스타일러렌탈을 하신고객님의 후기를 가지고 왔습니다.고민하고 계시는 분들은 이 글을보시고 도움이 되셨으면 좋겠습니다:)​[S5GBP] 모델 렌탈 진행하신김O정고객님의 후기입니다.","[['잘보고갑니다'], ['오• 좋은 정보 잘 보고 갑니다'], ['정보 감사합니다'], ['잘 보고 갑니다'], ['잘보고가요']]",2022.07.08. 15:00
LG전자 오브제 스타일러 S5GFO 사용후기예요.,"저희 집은 스타일러가 정말 필수인데요. 일주일에 3번 이상 사용을 하고 있어서 정말 잘 쓰고 있는 제품 중 하나예요. 밖에 입고 나갔던 옷은 세탁하지 않으면 옷장으로 절대 넣지 않는 성격인데, 외투나 세탁기를 자주 돌릴 수 없는 소재의 옷들은 항상 스타일러를 거친 후 옷장으로 들어갑니다. 이런 점이 정말 좋더라구요~ㅎㅎ 그리고 망가지기 쉬운 옷들도 세탁기 돌리고 건조기를 풀로 돌리지 않고 물기만 건조한 다음에 바로 스타일러에 넣어서 바짝 건조를 시켜주면 옷을 훨씬 오래 입을 수 있을 뿐만 아니라 관리하기도 좋아서 자주 이용하고 있어요. 남편 바지 주름잡는 것도 스타일러 이모가 해주시고 있어요. 스타일러가 없었으면 외부에 나갔다 온 옷들을 어떻게 관리해야 할지 정말 생각만 해도 끔찍합니다..ㅎ 처음에 구입할 때 5벌용으로 구입한게 신의 한수 였던 것 같고, 녹색의 무광으로 구입한 점도 손자국이 묻지 않아서 정말 잘 선택한 것 같아요!!","[['스타일러 진짜 있으면 너무 좋을 것 같아요!!'], ['와 스타일러 ..진짜 탐나네요 5벌 들어가믄 진짜 많이 들어가는거네용'], ['와 저도 저 바지필터 기대중이에요 예랑이가 정장입는 직장이라서요..! 넘 좋아요🙂']]",2022.04.03. 23:26
신림역 도보8분 신축첫입주 엘베있고 스타일러있는 3층 풀옵션 1.5룸입니다,신림역 도보8분 완전평지 조용한 주택가입니다​신축첫입주라 정말 깔끔합니다​엘베있습니다​풀옵션 스타일러까지 있어서 티브이만 가지고 오시면 됩니다​금액:18000만원관리비:10만원포함:티브인터넷별도:수도전기가스위치:신림동1631-11해당층:3층방구조(방/욕실개수):1.5룸 화장실1방향:동향옵션:에어컨 세탁기 냉장고 인덕션 스타일러용도(건축물대장):다중주택면적(전용/공급):약8평사용승인일:2022년난방방식:개별도시가스주차:불가반려동물:불가입주가능일:당장가능특이사항대박 부동산 서울 관악구 남부순환로191길3(신림동1410-10) 신림역도보8번출구3분010-8517-2455 대표 박정욱,[['반전세 가능할까요???']],2022.08.24. 14:22
