TITLES,REVIEW,COMMENTS,TIME
요즘은 원룸용 가구가전 저렴하게 너무 잘나오네요 (feat. 침대/스타일러),이번에 직장 근처로 집 옮기느라 자취 시작하게 됐는데가구도 그렇고 가전도 그렇게 원룸용 미니멀한 것들 진짜 저렴하게 잘 나오네요 :),"[['간이 의류관리기 정보 부탁드려요. 탐나네요.'], ['네이버에 휴대용 스타일러 뭐 이런 식으로 검색해 보시면 나옵니다ㅎㅎ'], ['우왕 진짜 잘나오네요!!!!'], ['요샌 좋은게 많더라구요ㅎㅎ'], ['오오 혹시 침대는 어디서 사셨어용??ㅠ 1인용침대 검색해도 소파베드 같은거바께 안나오던데ㅠㅠ'], ['침대는 동서가구 제품입니다ㅎㅎ'], ['저 간이 의류관리기는 주기적으로 옷을 털어주거나 바람이 나오는 효과가 있는건가요? 그냥 있으나마나한 자외선만 쐬주는거면 의미가 없을것 같아서요.'], ['네 다리부분에서 바람이 나와요ㅎㅎ']]",2022.04.13. 20:59
스피도 프리스타일러 색상무관하게 구해여~,요런디쟌이구여색상은 여러가지더라구여보라 핑크 파랑 호피… 색상상관없구여사이즈는 28루여^^연락 기다립니다~^^​,"[['오늘 벼룩글 보자마자 어제 로진님 올리신 글이 생각이 났어요.https://cafe.naver.com/swimmingholicclub/773650'], ['우아아아~울카페 해결사 곰돌님이시당 ㅋ감사드려여^^']]",2022.06.24. 13:31
"LG 오브제 워시타워,스타일러,건조기,올레드TV 새상품 저렴하게 판매합니다^^","요즘 핫한 LG 오브제 5벌 스타일러 새상품 저렴하게 드립니다. LG전문기사님이 직접 설치해드리며​스팀건조기, 65인치 올레드 TV도 있습니다. 100프로 새상품입니다.​요즘같은 코로나 시대에 스팀가전인 건조기,스타일러 필수인거 아시죠? 방송에 나왔을정도로 요즘은 ​건조기,스타일러 필수가전에 속합니다.^^ 문의사항은 연락주시면 언제든지 답변 드리겠습니다.^^​010-2558-8553 문의 주시면 됩니다^^ 건강한 삶을 위해서 이번기회에 구입해보시는 어떨런지요?^^​",[],2022.02.22. 19:24
LG전자 가전 패키지 구매후기,"이번에 이사를 앞두고 가전 준비하면서 알게된 점 느낀점 기록차 써봅니다.​​​우선 제 조건은 이랬습니다 ​​1. LG가전 위주, 삼성 고려 X2. 필요품목 : 75인치 티비, 얼음정수기냉장고, 워시타워(세탁기+건조기), 공기청정기, 스타일러 총 6품목 ​​​타임스퀘어, 롯백본점, 롯백잠실점, 롯백영등포점, 더현대, 현대백화점 목동점 등 백화점 및 각 베스트샵 대리점 직접방문, 비대면 견적 포함해서 20군데 정도 견적 받아본거 같구요, ​이중 한곳에서 최종 졸업했습니다.​​1. 75인치 나노셀 TV                75NANO75KQA2. 베이지얼음정수기냉장고       W823GBB1723. 워시타워(상 그린 하 베이지)  W20EGZM4. 공기청정기 AS352NB15. 스타일러 미러형 S5MBP​​​","[['상조도 결과적으로 이득이긴해여ㅋㅋ 근데 안하는게 맘편하긴함'], ['베스트샵, 백화점중 어디가 더 나으셨나요?\n이제 가전 보러 다녀야하는데ㅜㅜ'], ['오로지 최종 혜택가만 놓고본다면 베스트샵이 더 싸긴 싼거같아요 리워드중 일부를 엘지전자포인트로 준다는게 함정이지만.. 밥솥이든 믹서기든 대리점 와서 또 구매하도록 유도하는거죠 하지만 대리점중에서도 혜택중 포인트비중이 낮은 곳들이 있으니 견적 잘 비교해보셔요'], ['ㄷㅅㅂㄱ'], ['엘지가전 구매후기 잘보고 갑니다 ㅎ'], ['딱 찾고있었는데 정보 감사합니다'], ['엘지 가전 ㄷㅅㅂㄱ'], ['오호 혼수 준비 엘지가전 ㄷㅅㅂㄱ'], ['정성글 추천!!'], ['혼수 준비 엘지가전 ㄷㅅㅂㄱ'], ['고생하셨습니다  교통비써서 다니신만큼 가격할인 더  받으셨나요 ? 궁금합니다 ....  저도 발품팔아볼지 고민이라서 ....'], ['방문할수록 자잘하게 구매포인트도 나름대로 생기고, 프로모션에 따라 처음 생각한 조합하고 조금씩 달라지기도 하더라구요. 견적도 알아볼수록 점점 낮아졌구요 일단 처음 한번정도는 집근처 매장이라도 방문해보시고, 여건 안되신다면 비대면견적이라도 최대한 많이 받아보시는거 추천 드려요'], ['혼수 준비 엘지가던 ㄷㅅㅂㄱ'], ['엘지 가전 ㄷㅅㅂㄱ'], ['와 정성글 감사합니다!'], ['정말 감사합니다. 엘지 베스트샵 중에서도 직영점과 대리점의 차이가 크더라고 하더라구요. 혹시 비교 해보셨는지 궁금합니다.(Ex. 직영점은 엘지 베스트샵에서 운영하는 마켓이고, 대리점은 사장이 따로 있기 때문에 예를 들어 하나 팔았을 때 마진이 100 남는 상품이 있으면 직영점은 규정에 따라 100을 남겨야 하는데 대리점은 사장님 역량에 따라 마진을 50만 남기고 상품권으로 50만원을 페이백 해주는 식으로 운영이 가능하다고 하더라구요.)'], ['신혼 가전 준비때문에 현재 열심히 발품 파는 중인데 어느 분이 일련번호까지 동일한 상품으로 강X 본점/ 장X중앙점 견적 받았을 때 200만원 가량 차이났다고 하더라구요..'], ['네네 말씀하신 두곳 다 견적 받아봤던 곳이고.. 굳이 직영점과 대리점을 구분해서 알아보진 않았었지만 판매사원분이 말씀하시는 어투로 봤을때 대리점 같아보이는곳이 할인여력이 더 큰 것 같긴 했습니다.'], ['와 꼼꼼하시네요글 잘 보고 갑니다궁금한게 품목별 혜택가 안 알려주고 통으로 알려주는데 각 제품별로 할인가는 어떻게 배분하신건가요?사진에 엑셀표 보고 궁금해서 질문드려요'], ['전체혜택금액을, 총예산에서 각 품목이 차지하는 비중별로 임의로 뿌렸습니다! 예를들어 티비 5백 냉장고 3백 스타일러 1백 이라고 가정했을때 총 혜택금액을 5:3:1로 뿌려줬어요'], ['아 이해했습니다 ㅎㅎ감사합니다'], ['가전 ㄷㅅㅂㄱ'], ['왜여??'], ['저도 귱금 ㅠㅠ'], ['그럼싸게파세요 ㅋㅋ 다른곳 다 친절한데 비싸게사면 그게 호구지'], ['그럼 싸게파는지점에서 근무하세요 ㅋㅋ 한두푼하는것도아니고 저도 발품팔아서 첫견적보다 적어도 300이상 아낀듯요. 발품 팔만함 가격정책이 이딴식이면'], ['첫매장과 두번째 매장에서 호구잡힌게 좀 컸던거같음요 신규입주 지정매장에서 한것도 한몫했고요. 글고 삼성에서 엘지로 브랜드 갈아탔는데도 300이상 세이브했어요.'], ['충분히 이해 갑니다. 안 살 거 뻔히 보이는데 친절하게 응대해야하는 피곤함이...'], ['궁금한게 신규입점 매장은 진짜 혼수사면 말도 안되게 할인을 많이 해주던데 이건 어떻게 나올수있는 혜택인가요? 분명 LG나 삼성에서 사오는 가전가격이 정해져 있을텐데 어떻게 20%이상 할인을 해줄수 있는지 궁금하더라구요ㅋㅋ'], ['직원이 친절하셔도.. 가격이 불친절하면 최종선택을 고민하게되는건 어쩔수 없는거같아요 하지만 아무리 친절하게 상담해도 결국 팔지 못하면 상담료가 어디서 나오는게 아니니 영업사원분들의 고충도 충분히 이해합니다 그래서 저도 최대한 판매자 공수를 줄이고자 부가질문 없이 담백하게 견적만 받으려고 노력했습니다\n결혼준비하다보면 매순간이 선택의 연속이고, 그 과정에서 지나보낸 수많은 영업사원분들의 노고 리스펙합니다'], ['엘지'], ['가전 ㄷㅅㅂㄱ'], ['그냥 다른거 필요없고 지역 상관없이 백화점 오픈점 가서 사시면 됩니다 오픈점 가서도 견적 받고 바로 사지말고 일단 견적만 받고 딜 하면 더 할인 가능요'], ['혼수가전 ㄷㅅㅂㄱ'], ['혼수준비 ㄷㅅㅂㄱ'], ['그냥 인터넷이 젤 싸던데'], ['상조 혜택 그냥 적금이다 생각하면이득이여서 할인 받았네요'], ['2년전에 얼음정수기냉장고 구매할 때 lg전자렌탈케어 15900원 이였는데 2000원 올랐나보네요\n그때도 1년 무상이였습니다'], ['ㄷㅅㅂㄱ'], ['혼수 다시보기'], ['혼슈가전 꿀탑!'], ['ㄷㅅㅂㄱ'], ['ㄷㅅㅂㅈ'], ['엘지 가전 ㄷㅅㅂㄱ'], ['근데 오픈점 리뉴얼오픈 이런거말고\n진짜 처음오픈은 장난아니던데요\n동생 여러군데 견적받고 마지막으로\n좀 멀리있는 오픈점 찾아셔 견적받았는데\n이전 견적동일가에 노트북하나 더 생김ㅋㅋㅋ'], ['ㄷ'], ['엘지가전 ㄷㅅㅂㄱ'], ['가전 ㄷㅅㅂㄱ'], ['혼수 가전 ㄷㅅㅂㄱ'], ['혼수가전 ㄷㅅㅂㄱ'], ['가전사기 ㄷㅅㅂㄱ'], ['ㄷㅅㅂㄱ'], ['정설글이내요 ㅜㅜㅜㅜ 저도 내년에 준비할때 참고할게요'], ['가전 ㄷㅅㅂㄱ'], ['결혼준비 가전제품 ㄷㅅㅂㄱ'], ['엘지 가전 ㄷㅅㅂㄱ'], ['가전 ㄷㅅㅂㄱ'], ['ㄷㅅㅂㄱ'], ['ㄷㅅㅂㄱ'], ['9월에 구로본점 찐 오픈합니다. 전 여기 대기중이에요'], ['저도 여기 대기 중인데.. 리뉴얼이라 걱정되네요'], ['저도 여기 노려봐야겠네요 ㄷㄷ 정보감사합니다.'], ['엘지가전 다시보기'], ['다음에 꼭 참고하겠습니다 감사합니다~'], ['가전제품 ㄷㅅㅂㄱ'], ['대리점도 판매액 대비 수당 나온다면 차라리 솔직하게 수당 ㅇㅇ 나오는데 어디까지 맞춰줄 수 있다 하면 사는 양쪽 모두 시간 아끼고 빨리 구매 가능할듯요. 한쪽은 싸게 사고 싶고한쪽은 정해진 정책대로만 하고 싶으니 사는쪽은 가격이 중요할 수 밖에 없지요 사고나서 사후처리 대리점이 하는것도 아니고; 차 살때 딜러 서비스랑 같은 개념.'], ['엘지엘지'], ['전 엘지 베스트샵 부점장인 친구한테 전화 하니... 자기한테 하지말고 대구 경북에선 제일싼곳이 거기라고 해서 거기 가서 견적 냈는데 실제로 베스트샵보다 300이상 차이 나서 친구가 알려준 곳에서 했습니다.\n\n베스트샵 이랑 백화점 두군데 견적 내어 봣었는데... 역시 발품 팔아야 겠더라구요. 가는곳마다 할인이 다 달랐음.'], ['혹시 정보 쪽지로 가능하신가요\U0001f979'], ['저두 좀 부탁드립니다 ㅠㅠ'], ['헉 대구사람입니다.. 정보 부탁드려도 될까요ㅠㅠ'], ['저도 정보부탁드려요 ㅎ휴ㅠ'], ['저도 부탁드려요 ㅠㅠ'], ['저도 정보 쪽지로 부탁드립니다,,!'], ['보내드림'], ['보내드림'], ['보내드림'], ['저한테 말씀 안하셔서 안보내드림'], ['보내드림'], ['보내드림'], ['감사합니다 👍🏻👍🏻'], ['저도 정보 부탁드려요'], ['저도 정보 부탁드려요!'], ['보내드림'], ['보내드림'], ['저도 쪽지 부탁드려 봅니다!'], ['안녕하세요 ! 저도 쪽지 부탁드립니다 미리 감사드려요 !!'], ['보내드림'], ['보내드림'], ['혹시 원래 집은 대구고 다른 지역에 직장을 얻어 집을 사게 되어 입주하게 됐는데 다른지역까지 배달오려나요;;혹시 모르니 저도 정보좀 부탁합니다'], ['보내드림'], ['헉 저도 혹시 정보 쪽지 가능할까요~'], ['저도 혹시 공유 가능하실까요?ㅠ 쪽지부탁드립니다!ㅠㅠ'], ['라이언 님 늦었지만 저도 공유 받을수 있을까요?'], ['보내드림'], ['보내드림'], ['보내드림'], ['선생님 저도 좀 부탁드리겠습니다'], ['저도 쪽지 부탁드립니다🥺']]",2022.08.30. 14:34
강남 기와집 양대창 추천합니다 (LG 스타일러 비치되어있음),"0. 글제목에 기재내용 (예.말머리 지역체크, OO에 위치한 OO 맛집 추천합니다.) ​​​1. 대표메뉴 : 양, 대창, 막창 등​​​2. 상호 :  기와집 양대창 ​​​3. 주소 :   서울 서초구 서초대로78길 52 1층 101호​​​4. 영업시간 / 휴무일 : 매일 11시 ~ 23시​​​5. 추천내용(맛, 라이딩코스, 경치, 가격 등) 및 직접찍은 사진  ​아주 정말 맛있고 가격도 적당하니 좋습니다. 특히 이집엔 LG 스타일러가 여러대 구비되어 있어 고기냄새 걱정없이 식사하셔도 됩니다. 사장님의 센스가 엿보이네요.​","[['오... 멋진 생각이네요..  고깃집의 스타일러스...ㅎ'], ['스타일ㄹㅓ!!'], ['곱창은 사랑이쥬~']]",2022.01.10. 09:56
오늘 머시닝 프로브 스타일러 박살났네용,제가 부순건 아니고.. 신입 동료가 원점복귀를 z부터 안하고 xy를.. ​꽈직 하고 부러졋는데 비용이 ㅎㄷㄷ 하네요.앗세이로 갈아야한다고..,"[['비용이 얼마정도예요?저희도 쓰는데 비싸서 조심조심 하게되더라구요'], ['아직 저희도 얼마드는지 모르겟지만 수백은 깨질거라네요'], ['본체가 천만원돈 아닌가요?? 밑에 봉만 뿌러졌는데 비싸긴하네요 설치비 70만원에 이것저거 하면 그럴수도 있겠네요 수리하시면 얼마정도인지 쪽지라도 부탁드려요'], ['아 대리님이 겁준거였네요 ㅋㅋ 막대만 따로 교체된다고..'], ['넵 알게되면 말씀드릴게용'], ['네 블룸이죠? 처리 시간이랑 비용 얼마인지 저도 그냥 인지하고있게요'], ['메이커 말씀하시는거면 저희는 레니쇼 쓰고있어용'], ['정확히는 위에 본체가 터치프로브 헤드이고 막대기를 스타일러스 라고 합니다.스타일러스는 얼마 안하는데 그거 교체하고 캘리브레이션 하는 과정이 귀찮지요.지그에 작은 홀들 찍을 일이 많아서 6파이에서 3파이 길이50mm로 바꿔서 사용하고 있는데 스타일러스 비용 자체는 10만원 안팎입니다.'], ['아하 스타일러스.. 알려주셔서 감사합니다'], ['오홍 감사합니다'], ['터치프로브 헤드 박살나면 천만원스타일러스는 6파이 기본 12만원정도면 갈아요 ㅎㅎ'], ['안녕하세요 블룸 측정기 직원입니다스타일러스 100mm 6파이 기준으로 185000원입니다스타일러스만 교환하시면 가능하십니다'], ['원점복귀어처피 z축먼저안하고  xyz순으로해도 상관없지않아요?'], ['제품 옆에 프로브 맞닿아있는데 z방향으로 회피안하고 x축으로 팍~ 쳐버린거죵'], ['저도 처움 작업 할때 급하게 하는라.... 많이 부러졌지요....ㅠ.ㅠ'], ['저거 쓰는 회사들 은근 많네요, 측정기구라 하는데 동심도 수시로 맞춰주는것도 일이고, 한두번 쓰다보면 또 안맞고 전 회사에서 가공 후 측정데이터 자료로 남기라고 해서 썻는데,,,'], ['교환하고 교정해야 합니다교정하는게 생각보다 어렵습니다 '], ['프로브만 파손이면 가격저렴하꺼고 몸통도 파손이면  비용 좀나오갰지요 몸통 사진 도 올려보셔요....'], ['저거만 부러진거면 얼마안하는데요..'], ['']]",2022.04.15. 23:28
"수영역 드레스룸,스타일러,건조기 풀옵션 신축 첫입주 쓰리룸 전세 , 광안동 신혼부부추천 보증보험가입有","안녕하세요 집준비입니다오늘도 역시 날씨가 너무너무 덥네요ㅜㅜ 그와중에 비가오려는지 찝찝하네요괜히밖에 나가면 기분을 망칠것같습니다ㅋㅋ사무실에서 일을보고있는데 시원한 실내가 역시 최고네요!오늘은 신축 첫입주 쓰리룸 전세 소개해드리려고 가지고왔습니다이번에 보여드릴 집은 옵션이 굉장히 좋은집입니다1인가구는 물론 2인 신혼부부까지 넓게 지내실 수 있는 너무예쁜 신축건물이에요현재 계약중이며 입주도 바로가능합니다바로 자세히 설명도와드리겠습니다 ^,^",[],2022.06.22. 09:57
위글위글x벨리곰🐻,"아이들과 4월 부산여행갔을 때100층 엑스더스카이에서 벨리곰과 사진을 찍었었어용,그때 벨리곰 인형이 품절이라 못사왔는데위글위글이 콜라보를 했더라구요😊스마일쿠션,곰쿠션 다 있지만 그때 여행을 떠올리며 구매했어요!쿠션에 든 담요가 허리에 두르기 너무 좋아 원래 하나 더 사려고 했다며 합리화해봅니다ㅎ​사진은 스타일러에서 갓 나온 벨리곰","[['너무 귀여워요 🥰'], ['네 실물보니 더 귀엽더라구요😊'], ['여자아이들이 넘좋아할것같아요^^'], ['핑크곰이라 더 그래보이지용!\n전 아들둘이지만 그래도 좋아해요 ㅎㅎ'], ['쿠션으로써 실용적일까요??'], ['쿠션감도 좋고 담요로써도 충분히 전 잘사용해지더라구요, 불편했더라도 생긴게 용서되는 쿠션들이긴 하지만요 ㅎㅎ'], ['얼마전에 거제도에 케이블카 타러 갔는데 요 곰돌이가 있던데 ^^'], ['여기저기 있는 캐릭이더라구요, 귀여워용❤️'], ['큰밸리곰, 앉은밸리곰 다 너무 귀엽더라고요 ㅋㅋ']]",2022.08.27. 14:47
에어스타일러,바쁜 아침 머리 스타일링을 손쉽게 도와주는효자 아이템 ㅎㅎ고데기는 머리 덜마르면 못하는데이건 말리면서 동시에 컬 넣을수 있어서 좋아요,[],2022.07.05. 00:37
스타일러 색상 골라주세요~~,전 미러가 좋은데 신랑은 분홍이를 고르네요색 고르기 어려워요ㅠㅠ,"[['저두 미러요. 전신거울 따로 없어도되고 좋을거같아요'], ['그쵸ㅋㅋ저두 그생각이에요ㅋ'], ['오~~저도 미러에 한표요,'], ['오~미러2표~~'], ['저흰 미러예용ㅎㅎ\n옷방에 두니 전신거울 처럼 사용하고 좋더라구요^^'], ['거울 손자국 마니 나겠죠ㅠ\n그래도 저도 미러가 끌리네요ㅎ'], ['손자국 많이 안 생겨요~^^\n청소하실때마다 쓱 닦아주심 됩니당ㅎㅎ'], ['저라면 미러요^^'], ['미러가 압도적이네요ㅋㅋ'], ['저는 베이지가 끌리네요ㅎㅎ'], ['베이지가 깔끔하긴 하죠ㅋㅋ실물로보니 색이 귀엽더라구요ㅎ'], ['화이트요. 미러는 손자국이 ㅠㅠ'], ['그쵸.. 저도 손자국 땜에 고민이긴 하네요ㅠ'], ['미러지유~^^'], ['미러가 이쁘긴 최고 이쁘더라구요ㅋㅋ'], ['저도 미러요'], ['역시 여자들은 보는 눈이 비슷한가봐요 저도 미러가 최고 이뻤어요ㅎ'], ['미러요~~~!!'], ['미러가 압도적이네요 이쁘긴 미러가 이쁘죠ㅋ'], ['드레스룸에 놓을거면 미러 \n거실이나 방에 놓아야한다면 베이지 요'], ['아쉽지만 베이지로 했어요ㅠㅠ그래도 베이지도 이쁘니 기쁜마음으로 쓰려구요ㅎ'], ['저도 미러요'], ['아쉽지만 베이지로 결정했어요ㅠㅠ'], ['무광도 이쁠거 같아요 저도 무광좋아요ㅎ'], ['저두 베이지 살까하다가 미러 샀어요~~~'], ['아쉽지만 베이지로ㅠㅠ 신랑이랑 반씩 양보했네요ㅋ'], ['지금 저 미러제품 행사 가격이 얼마래요..?'], ['가격이 생각이 안나요ㅠ130~45안쪽이었던듯 한데..'], [''], ['저희 냉장고 미러인데 너무 좋아요.. 하지만 연식이 오래 되면서 미러 끝부분에 부식이 되기 시작 합니다.\n하지만 아주 좋아요~^^'], ['저도 미러가 1번이었는데.. 신랑이랑 반씩 양보해서 베이지 선택이요ㅎ'], ['저도 미러요~~ 전신 거울 따로 안둬도 되서 좋은데 \n딱 한가지! 지문은 자주 닦아주셔야 해요\n근데 어차피 전신거울도 먼지 앉는건 똑같아서\n조금 더 자주 닦는게 문제라면 전 그냥 더 많이 닦더라도\n미러 추천드려요~~^^'], ['추천 감사해요~ 근데 베이지로 결정.. 신랑이랑 반씩 양보했네요ㅎ'], ['저라면 무광베이지요 ㅋㅋㅋ 전신거울은 더 이쁜걸 사둘 것 같아서 ㅋㅋㅋ'], ['베이지도 이뻐요 귀여운 베이지ㅎㅎ 무광 다음으로 찜꽁한 색이에요ㅎ'], ['미러로했어요 거울 따로두기싫어서 ㅎㅎ 결론은 대만족입니다'], ['저도 미러했으면 전신거울 버릴라했는데 실패했네요ㅋㅋ\n신랑이랑 반씩 양보해서 베이지 결정이요ㅎ'], ['저도 딱 보자마자 예쁘다. 미러로 생각했는데 손자국과 트롬이라 적힌게..요즘 오브제라인이 넘 예쁘니깐요. 그래서 저도 베이지 했어요.']]",2022.03.10. 20:20
가전제품은 아무리 고민해도 역시 LG! 엘지에서 가전 졸업했어요 ㅎㅎ,"여러군데를 서치한 끝에 일부러 날을 잡고 오픈매장으로 유명하다는 LG전자 강남본점으로 갔어요.주말이라 그런지 사람이 엄~~청 많았고 예약한 시간보다 2시간 일찍 갔더니 매장 둘러보시면서 대기하시면 바로 전화를 주시겠다고 하시더라고요.​한 20분? 정도 예랑이랑 같이 매장 둘러보고 있는데 전화가 왔고 만난 박상호 팀장님!​제일 먼저 보시려는 가전 제품이 뭔지를 물어보시고,상담하는 과정에서 어떤걸 더하면 가격이 더 저렴해질 수 있는지를 최우선으로 해서 가격과 효율을 다 잡는 구조로 설명을 해주시겠다 하시더라고요.​그 결과 원래 구매하려고 한 가전제품은​- 워시타워- 냉장고- 김치 냉장고- 무선 청소기- 공기 청정기​위와 같은 리스트였고 견적을 뽑은 결과 1500만원대에 체감가 1000만원대 중반이 나왔었는데박상호 팀장님과 같이 각 층을 돌아다니며 안내를 받고 또 이걸 이렇게 바꾸면 얼마나 저렴해지는지 등에 대해 안내를 받은 결과​아래와 같은 목록을 구매하게 되었습니다!","[['맞아요! 역시 엘지!!'], ['가격이 삼성보다 좀 비싸긴 하지만... 엘지!!'], ['체감가 진짜 좋은거같아요!! 저도 무조건 가전은 엘지라!! 강남본점 꼭가야겟어욯ㅎ'], ['강남본점이 엄청 유명하길래 왜 그런가 했더니...!! 꼭 오픈 행사 하는 기간에 가세요~ 저도 그 행사 덕분에 가격 많이 저렴해진거 같아요!'], ['확실히 엘지전자가 예버영 ㅠㅠ'], ['엘지 오브제 특유의 색감이 늠 좋아서 가전은 처음부터 무조건 엘지로 생각했었네요 ㅜㅜ!!!'], ['너무 잘 받은거 같아용! 박상호 팀장님 번호 알 수 있을까용??'], ['쪽지 보내드렸어요!!\n제가 처음 생각한 견적보다 더 업그레이드 하면서 가격이 저렴해지게 견적 잘 뽑아주시는거 같아요 ㅎㅎ'], ['저도 아직 가전 알아보진 않았지만, 본가에서 쓰는 것도 럭키금성..이 많고.. 실제로 30년 넘게 쓰고 있는걸 보니까 가전은 엘지라는 생각이 자연스럽게 박히더라구욬ㅋㅋ'], ['맞아요! 제 주변분도 본가에 가면 금성 선풍기가 아직도 있다며...ㅋㅋㅋ 고장 안나고 오래 쓸 수 있는게 좋은거 같아요 ^.^'], ['온라인에서 해결하셨군요 역시 가전제품은 엘지에요 ㅋㅋ'], ['가격만 조~~금만 내려갔음 더 좋을거 같긴 해요 ㅜㅜㅋㅋㅋㅋ'], ['블루베리23님, ""2022 까사미아 하반기 정기세일"" 행사 후기 이벤트 당첨을 축하드리며, 참여해주셔서 감사합니다. 자세한 내용은 쪽지를 확인해주세요🥳'], ['오옹 감사합니당❤️'], ['넘 잘 받으셨습니다^^~ 저도 팀장님 번호 좀 알 수 있을까요? 부탁드려요'], ['쪽지 보내드렸어요!!'], ['안녕하세요! 저도 팀장님 번호 좀 알 수 있을까요? :)'], ['쪽지 보내드렸어요!!']]",2022.07.26. 10:32
귤현동신축빌라 귤현역 매매,귤현동신축빌라 분양정보,"[['중문이 있는집이랑 없는집의 차이가 많을까요.'], ['예전 신축빌라 고민하다 원하던집을 놓쳤는데 이번에는 좀 더 서둘러야겠어요~'], ['신축빌라 구매 후 세금은 얼마나 나오느지 궁금하네요'], ['지하철까지는 얼마나 걸리는지 알고싶네요 전철을 이용해야거든요ㅎ'], ['주말에 신축빌라 투어신청하고 싶은데 쪽지주세요..'], ['주방이랑 거실이랑 분리된 신축빌라 찾아요 가능한지 궁금하네요!'], ['방3개가 모두 크면 좋겠어요 빌라는 방이 작다는 인식이 있어서요'], ['신축빌라 가격도 계속 오르는거 같은데 서둘러서 결정해야겠네요.']]",2022.08.29. 12:32
